<!DOCTYPE organisation-initialisation
		PUBLIC "-//NightLabs GmbH//DTD Organisation Initialisation 1.0//EN"
		"http://www.nightlabs.de/dtd/organisation-init_1_0.dtd">
<organisation-initialisation>

	<init bean="jfire/ejb/JFireTestSuite/JFireTestManager" method="initialiseTestSystem" priority="900">
	</init>
	
	<init bean="jfire/ejb/JFireTestSuite/JFireTestManager" method="initialise" priority="950">
		<depends module="JFireSimpleTrade.ear" resolution="optional" />
		<depends module="JFireVoucher.ear" resolution="optional" />
		<depends module="JFireDynamicTrade.ear" resolution="optional" />
		<depends module="JFireChezFrancois.ear" resolution="optional" />
		<depends module="CrossTicketWonderland.ear" resolution="optional" />
	</init>
</organisation-initialisation>	