<!DOCTYPE organisation-initialisation
		PUBLIC "-//NightLabs GmbH//DTD Organisation Initialisation 1.0//EN"
		"http://www.nightlabs.de/dtd/organisation-init_1_0.dtd">
<organisation-initialisation>
	<init bean="jfire/ejb/JFireBaseBean/ConfigManager" method="initialise"/>
	<init bean="jfire/ejb/JFireBaseBean/OrganisationManager" method="registerInRootOrganisation" priority="999"/>
	<init bean="jfire/ejb/JFireBaseBean/JFireTimer" method="startTimer" priority="998"/>
	<init bean="jfire/ejb/JFireBaseBean/PersistentNotificationEJB" method="initialise"/>
	<init bean="jfire/ejb/JFireBaseBean/PropertyManager" method="initialise"/>
	<init bean="jfire/ejb/JFireBaseBean/EditLockManager" method="initialise"/>
	<init bean="jfire/ejb/JFireBaseBean/JFireSecurityManager" method="initialise"/>
</organisation-initialisation>
